site_id,site_name,primary_color,faq_id,category,keywords,question,answer,reference_note,reference_url,ai_context,valid,created_at,updated_at
cansuke,Cansuke Support,#359DD2,faq_cs_01,Lịch trình,giờ làm việc|mở cửa|thời gian,Công ty mở cửa mấy giờ?,Chúng tôi làm việc từ 8:00 đến 17:00 từ Thứ 2 đến Thứ 6.,Xem thêm lịch nghỉ lễ tại web,https://cansuke.com/schedule,Áp dụng cho toàn bộ nhân viên và khách hàng vãng lai,1,2026-01-15 09:00:00,2026-05-29 15:30:00
cansuke,Cansuke Support,#359DD2,faq_cs_02,Tài khoản,đăng ký|tạo tài khoản|tham gia,Làm sao để đăng ký thành viên?,Bạn bấm vào nút Đăng ký ở góc phải màn hình và điền thông tin.,Yêu cầu xác thực OTP email,https://cansuke.com/register,Dành cho khách hàng mới muốn trải nghiệm dịch vụ,1,2026-01-16 10:20:00,2026-01-16 10:20:00
c-wing,C-Wing Global,#396e11,faq_cw_01,Chi phí,báo giá|bản quyền|giá tiền|mua,Phần mềm có giá bao nhiêu?,Chi phí được tính dựa trên số lượng user sử dụng hàng tháng.,Liên hệ phòng kinh doanh để nhận chiết khấu,https://c-wing.com/pricing,Chính sách giá áp dụng từ năm 2026,1,2026-02-01 08:00:00,2026-03-12 11:15:00
account,Account Central,#940A3B,faq_ac_01,Bảo mật,quên mật khẩu|đổi pass|mất mật mã,Lỡ quên mật khẩu thì làm thế nào?,Bạn vào trang đăng nhập chọn Quên mật khẩu để nhận mã cấp lại.,Hệ thống tự gửi mail sau 30 giây,https://account.central.com/forgot,Quy trình bảo mật xác thực 2 lớp,1,2026-03-20 14:45:00,2026-03-20 14:45:00
s-wing,S-Wing Tech,#0f50c1,faq_sw_01,Hỗ trợ,bảo trì|lỗi phần mềm|hỗ trợ kỹ thuật,Phần mềm bị lỗi thì liên hệ ai?,Vui lòng gửi yêu cầu hỗ trợ vào trang Ticket kỹ thuật trực tuyến.,Hotline trực 24/7: 1900-xxxx,https://s-wing.com/ticket,Hỗ trợ kỹ thuật cấp độ 1 cho khách hàng doanh nghiệp,1,2026-04-05 16:00:00,2026-05-20 09:10:00
